{
  "title": "연무동 저녁 같이 해볼 4명 찾고 있어요",
  "summary": "연무동 근처에서 저녁 같이 드실 분 모아요. 저도 동네에서 가볍게 지내는 또래라 부담 없이 오셔도 돼요.",
  "tags": ["연무동", "저녁모임", "소규모", "초면환영"],
  "price_label": "1인 약 18,000원",
  "region_label": "수원시 연무동",
  "time_label": "4/18(금) 19:00",
  "status": "recruiting",
  "supporter_label": "supporter_teacher"
}
